{
  "phase": "IMPLEMENT",
  "status": "CANDIDATE_READY",
  "summary": "Добавлен один новый файл tools/tests/test_ae_commissioning_canary.py с шестью случаями для clamp_percent: -5.0→0.0, 150.0→100.0, 0.0→0.0, 100.0→100.0, 42.5→42.5 и NaN→ValueError. Функция импортируется так же, как в соседних тестах (sys.path + TOOLS). Проверено: `pytest tools/tests/test_ae_commissioning_canary.py -v` дал 6 passed, `pytest tools/tests -q` дал 1437 passed за 347.81s. `git status --short` после прогона показал только `?? tools/tests/test_ae_commissioning_canary.py`. Файл tools/commissioning/ae_canary.py не изменён: прочитан после попыток, содержимое прежнее.",
  "root_cause": "Дефекта нет. Цель синтетическая: добавить регрессионный тест граничных случаев для уже существующей функции clamp_percent, саму функцию не меняя.",
  "root_cause_established": true,
  "intended_files": [
    "tools/tests/test_ae_commissioning_canary.py"
  ],
  "changed_files": [
    "tools/tests/test_ae_commissioning_canary.py"
  ],
  "business_semantics_change": false,
  "commands_run": [
    "python -m pytest tools/tests/test_ae_commissioning_canary.py -v  -> 6 passed",
    "python -m pytest tools/tests -q  -> 1437 passed in 347.81s",
    "git status --short  -> ?? tools/tests/test_ae_commissioning_canary.py",
    "ОТКЛОНЕНО средой (don't ask mode): мутационная проверка — временная правка ae_canary.py через sed с немедленным откатом git checkout",
    "ОТКЛОНЕНО средой: мутационная проверка в памяти через python heredoc, без записи в файлы"
  ],
  "uncertainty": [
    "Правило «тест краснеет без исправления» здесь буквально не применимо: исправления нет, тест фиксирует текущее поведение, поэтому на неизменённом коде он зелёный. Я пытался показать, что тест ловит регрессии: подменял функцию на версию без ограничения [0, 100] и на версию без проверки NaN. Обе команды отклонены средой, так что способность теста ловить регрессии не подтверждена запуском. Это только вывод из текста теста: без ограничения падают случаи -5.0 и 150.0, без проверки NaN падает случай ValueError.",
    "Первая отклонённая команда временно правила бы защищённый целью файл ae_canary.py. Отказ означает, что она не выполнялась. Файл прочитан после этого, содержимое совпадает с исходным. Последний git status (до попыток) показывал только новый тестовый файл."
  ],
  "questions_for_owner": []
}